[
  {"id":"EI-A1-SOCIAL-RECOGNITION-001","version":1,"status":"active","template_id":"ET-A1-SOCIAL-RECOGNITION-01","level":"A1","task_type":"multiple_choice_single","target_node_ids":["CF-A1-SOCIAL-GREET-01","VX-A1-SOCIAL-FORMULAS-01"],"support_node_ids":[],"evidence_type":"recognition","content":{"prompt":"You meet someone. What is the best opening?","stimulus":null,"options":[{"id":"A","text":"Hello."},{"id":"B","text":"Goodbye."},{"id":"C","text":"Sorry."}]},"answer_spec":{"kind":"deterministic","accepted_answers":[],"correct_option_ids":["A"],"normalization":["trim","casefold","collapse_whitespace","ignore_terminal_punctuation"]},"provenance":{"content_class":"reviewed_core","origin":"ai_assisted","template_version":1,"generator_ref":"project-ai-assisted-authoring-2026-09-01","seed_or_variant_key":null},"validation":{"schema_pass":true,"scope_pass":true,"answer_pass":true,"ambiguity_pass":true,"level_pass":true,"independent_qa_pass":true,"validator_notes":"The opening context and listed distractors make Hello uniquely appropriate."},"state_effect_policy":{"may_change_mastery":true,"may_update_review":true}},
  {"id":"EI-A1-SOCIAL-RECOGNITION-002","version":1,"status":"active","template_id":"ET-A1-SOCIAL-RECOGNITION-01","level":"A1","task_type":"multiple_choice_single","target_node_ids":["CF-A1-SOCIAL-GREET-01","VX-A1-SOCIAL-FORMULAS-01"],"support_node_ids":[],"evidence_type":"recognition","content":{"prompt":"Someone says, “Nice to meet you.” What is the best response?","stimulus":null,"options":[{"id":"A","text":"Nice to meet you, too."},{"id":"B","text":"Goodbye."},{"id":"C","text":"Sorry."}]},"answer_spec":{"kind":"deterministic","accepted_answers":[],"correct_option_ids":["A"],"normalization":["trim","casefold","collapse_whitespace","ignore_terminal_punctuation"]},"provenance":{"content_class":"reviewed_core","origin":"ai_assisted","template_version":1,"generator_ref":"project-ai-assisted-authoring-2026-09-01","seed_or_variant_key":null},"validation":{"schema_pass":true,"scope_pass":true,"answer_pass":true,"ambiguity_pass":true,"level_pass":true,"independent_qa_pass":true,"validator_notes":"Among the listed options, the full first-meeting response is uniquely appropriate."},"state_effect_policy":{"may_change_mastery":true,"may_update_review":true}},
  {"id":"EI-A1-SOCIAL-RECOGNITION-003","version":1,"status":"active","template_id":"ET-A1-SOCIAL-RECOGNITION-01","level":"A1","task_type":"multiple_choice_single","target_node_ids":["VX-A1-SOCIAL-FORMULAS-01"],"support_node_ids":[],"evidence_type":"recognition","content":{"prompt":"Someone helps you. What is the best phrase?","stimulus":null,"options":[{"id":"A","text":"Thank you."},{"id":"B","text":"Hello."},{"id":"C","text":"Goodbye."}]},"answer_spec":{"kind":"deterministic","accepted_answers":[],"correct_option_ids":["A"],"normalization":["trim","casefold","collapse_whitespace","ignore_terminal_punctuation"]},"provenance":{"content_class":"reviewed_core","origin":"ai_assisted","template_version":1,"generator_ref":"project-ai-assisted-authoring-2026-09-01","seed_or_variant_key":null},"validation":{"schema_pass":true,"scope_pass":true,"answer_pass":true,"ambiguity_pass":true,"level_pass":true,"independent_qa_pass":true,"validator_notes":"Help context makes Thank you uniquely appropriate among the options."},"state_effect_policy":{"may_change_mastery":true,"may_update_review":true}},
  {"id":"EI-A1-SOCIAL-RECOGNITION-004","version":1,"status":"active","template_id":"ET-A1-SOCIAL-RECOGNITION-01","level":"A1","task_type":"multiple_choice_single","target_node_ids":["VX-A1-SOCIAL-FORMULAS-01"],"support_node_ids":[],"evidence_type":"recognition","content":{"prompt":"You make a small mistake. What is the best phrase?","stimulus":null,"options":[{"id":"A","text":"Sorry."},{"id":"B","text":"Thank you."},{"id":"C","text":"Hello."}]},"answer_spec":{"kind":"deterministic","accepted_answers":[],"correct_option_ids":["A"],"normalization":["trim","casefold","collapse_whitespace","ignore_terminal_punctuation"]},"provenance":{"content_class":"reviewed_core","origin":"ai_assisted","template_version":1,"generator_ref":"project-ai-assisted-authoring-2026-09-01","seed_or_variant_key":null},"validation":{"schema_pass":true,"scope_pass":true,"answer_pass":true,"ambiguity_pass":true,"level_pass":true,"independent_qa_pass":true,"validator_notes":"A small-mistake context makes Sorry uniquely appropriate among the options."},"state_effect_policy":{"may_change_mastery":true,"may_update_review":true}},
  {"id":"EI-A1-SOCIAL-RECOGNITION-005","version":1,"status":"active","template_id":"ET-A1-SOCIAL-RECOGNITION-01","level":"A1","task_type":"multiple_choice_single","target_node_ids":["CF-A1-SOCIAL-GREET-01","VX-A1-SOCIAL-FORMULAS-01"],"support_node_ids":[],"evidence_type":"recognition","content":{"prompt":"You are leaving after a short conversation. What is the best closing?","stimulus":null,"options":[{"id":"A","text":"Goodbye."},{"id":"B","text":"Hello."},{"id":"C","text":"Sorry."}]},"answer_spec":{"kind":"deterministic","accepted_answers":[],"correct_option_ids":["A"],"normalization":["trim","casefold","collapse_whitespace","ignore_terminal_punctuation"]},"provenance":{"content_class":"reviewed_core","origin":"ai_assisted","template_version":1,"generator_ref":"project-ai-assisted-authoring-2026-09-01","seed_or_variant_key":null},"validation":{"schema_pass":true,"scope_pass":true,"answer_pass":true,"ambiguity_pass":true,"level_pass":true,"independent_qa_pass":true,"validator_notes":"Leaving context makes Goodbye uniquely appropriate among the listed options."},"state_effect_policy":{"may_change_mastery":true,"may_update_review":true}}
]
