[
  {"id":"EI-A1-SOCIAL-CONTROLLED-001","version":1,"status":"active","template_id":"ET-A1-SOCIAL-CONTROLLED-01","level":"A1","task_type":"short_answer","target_node_ids":["CF-A1-SOCIAL-GREET-01","VX-A1-SOCIAL-FORMULAS-01"],"support_node_ids":[],"evidence_type":"controlled_production","content":{"prompt":"You meet someone. Write one greeting from this lesson.","stimulus":null,"options":[]},"answer_spec":{"kind":"deterministic","accepted_answers":["Hello","Hi"],"correct_option_ids":[],"normalization":["trim","casefold","collapse_whitespace","ignore_terminal_punctuation"],"word_limit":1},"provenance":{"content_class":"reviewed_core","origin":"ai_assisted","template_version":1,"generator_ref":"project-ai-assisted-authoring-2026-09-01","seed_or_variant_key":null},"validation":{"schema_pass":true,"scope_pass":true,"answer_pass":true,"ambiguity_pass":true,"level_pass":true,"independent_qa_pass":true,"validator_notes":"Both reviewed greetings are intentionally accepted, so the task does not pretend only one natural greeting exists."},"state_effect_policy":{"may_change_mastery":true,"may_update_review":true}},
  {"id":"EI-A1-SOCIAL-CONTROLLED-002","version":1,"status":"active","template_id":"ET-A1-SOCIAL-CONTROLLED-01","level":"A1","task_type":"short_answer","target_node_ids":["VX-A1-SOCIAL-FORMULAS-01"],"support_node_ids":[],"evidence_type":"controlled_production","content":{"prompt":"Someone helps you. Write the two-word phrase from this lesson.","stimulus":null,"options":[]},"answer_spec":{"kind":"deterministic","accepted_answers":["Thank you"],"correct_option_ids":[],"normalization":["trim","casefold","collapse_whitespace","ignore_terminal_punctuation"],"word_limit":2},"provenance":{"content_class":"reviewed_core","origin":"ai_assisted","template_version":1,"generator_ref":"project-ai-assisted-authoring-2026-09-01","seed_or_variant_key":null},"validation":{"schema_pass":true,"scope_pass":true,"answer_pass":true,"ambiguity_pass":true,"level_pass":true,"independent_qa_pass":true,"validator_notes":"The prompt asks specifically for the reviewed two-word phrase, making Thank you deterministic within lesson scope."},"state_effect_policy":{"may_change_mastery":true,"may_update_review":true}},
  {"id":"EI-A1-SOCIAL-CONTROLLED-003","version":1,"status":"active","template_id":"ET-A1-SOCIAL-CONTROLLED-01","level":"A1","task_type":"short_answer","target_node_ids":["VX-A1-SOCIAL-FORMULAS-01"],"support_node_ids":[],"evidence_type":"controlled_production","content":{"prompt":"You make a small everyday mistake. Write the one-word apology from this lesson.","stimulus":null,"options":[]},"answer_spec":{"kind":"deterministic","accepted_answers":["Sorry"],"correct_option_ids":[],"normalization":["trim","casefold","collapse_whitespace","ignore_terminal_punctuation"],"word_limit":1},"provenance":{"content_class":"reviewed_core","origin":"ai_assisted","template_version":1,"generator_ref":"project-ai-assisted-authoring-2026-09-01","seed_or_variant_key":null},"validation":{"schema_pass":true,"scope_pass":true,"answer_pass":true,"ambiguity_pass":true,"level_pass":true,"independent_qa_pass":true,"validator_notes":"The prompt asks for the reviewed one-word apology, so Sorry is deterministic within lesson scope."},"state_effect_policy":{"may_change_mastery":true,"may_update_review":true}},
  {"id":"EI-A1-SOCIAL-CONTROLLED-004","version":1,"status":"active","template_id":"ET-A1-SOCIAL-CONTROLLED-01","level":"A1","task_type":"short_answer","target_node_ids":["CF-A1-SOCIAL-GREET-01","VX-A1-SOCIAL-FORMULAS-01"],"support_node_ids":[],"evidence_type":"controlled_production","content":{"prompt":"You are leaving. Write one closing from this lesson.","stimulus":null,"options":[]},"answer_spec":{"kind":"deterministic","accepted_answers":["Goodbye","Bye"],"correct_option_ids":[],"normalization":["trim","casefold","collapse_whitespace","ignore_terminal_punctuation"],"word_limit":1},"provenance":{"content_class":"reviewed_core","origin":"ai_assisted","template_version":1,"generator_ref":"project-ai-assisted-authoring-2026-09-01","seed_or_variant_key":null},"validation":{"schema_pass":true,"scope_pass":true,"answer_pass":true,"ambiguity_pass":true,"level_pass":true,"independent_qa_pass":true,"validator_notes":"Both reviewed closings are accepted, preserving natural variation without ambiguity."},"state_effect_policy":{"may_change_mastery":true,"may_update_review":true}},
  {"id":"EI-A1-SOCIAL-CONTROLLED-005","version":1,"status":"active","template_id":"ET-A1-SOCIAL-CONTROLLED-01","level":"A1","task_type":"short_answer","target_node_ids":["CF-A1-SOCIAL-GREET-01","VX-A1-SOCIAL-FORMULAS-01"],"support_node_ids":[],"evidence_type":"controlled_production","content":{"prompt":"Someone says, “Nice to meet you.” Write the full response used in this lesson.","stimulus":null,"options":[]},"answer_spec":{"kind":"deterministic","accepted_answers":["Nice to meet you, too"],"correct_option_ids":[],"normalization":["trim","casefold","collapse_whitespace","ignore_terminal_punctuation"],"word_limit":5},"provenance":{"content_class":"reviewed_core","origin":"ai_assisted","template_version":1,"generator_ref":"project-ai-assisted-authoring-2026-09-01","seed_or_variant_key":null},"validation":{"schema_pass":true,"scope_pass":true,"answer_pass":true,"ambiguity_pass":true,"level_pass":true,"independent_qa_pass":true,"validator_notes":"The prompt explicitly asks for the full reviewed response, so the accepted answer is deterministic within lesson scope."},"state_effect_policy":{"may_change_mastery":true,"may_update_review":true}},
  {"id":"EI-A1-SOCIAL-SPEAK-001","version":1,"status":"active","template_id":"ET-A1-SOCIAL-SPEAK-01","level":"A1","task_type":"free_spoken","target_node_ids":["CF-A1-SOCIAL-GREET-01"],"support_node_ids":["VX-A1-SOCIAL-FORMULAS-01"],"evidence_type":"free_spoken_production","content":{"prompt":"Say one appropriate phrase for each cue: 1) you meet someone; 2) someone helps you; 3) you make a small mistake; 4) you leave.","stimulus":null,"options":[]},"answer_spec":{"kind":"rubric","rubric_id":"RUB-A1-SOCIAL-FORMULAS-PRACTICE-01","dimensions":["task_completion","formula_choice","intelligibility"],"minimum_evaluator_confidence":"high"},"provenance":{"content_class":"reviewed_core","origin":"ai_assisted","template_version":1,"generator_ref":"project-ai-assisted-authoring-2026-09-01","seed_or_variant_key":null},"validation":{"schema_pass":true,"scope_pass":true,"answer_pass":true,"ambiguity_pass":true,"level_pass":true,"independent_qa_pass":true,"validator_notes":"This is reviewed spoken practice for the communicative-function node. The vocabulary node is support only. No automated score or state change is permitted until a speech evaluator is calibrated."},"state_effect_policy":{"may_change_mastery":false,"may_update_review":false}}
]
